{
 "vendor_id": "V-00417",
 "legal_name": "Juniper Lane Ceramics LLC",
 "business_name": "Juniper Lane Studio",
 "tax_classification": "llc",
 "llc_tax_classification": "s_corporation",
 "has_foreign_partners": false,
 "address": {
  "street": "418 Example Avenue",
  "city": "Springfield",
  "state": "OR",
  "postal_code": "97477"
 },
 "ein": "12-3456789",
 "remit_email": "ap@example.com",
 "certified_on": "2026-03-14"
}
